0,,4
1,"""1、负责应用系统的版本发布工作",0
2,"如你有品牌设计经验，也有UI设计背景，那就来吧！""",1
3,"协助解决生产系统生产问题""",4
4,根据项目需求完成多媒体交互图形界面开发，完成数据交互、动态信息展现,1
5,根据产品提供的需求文档，评审需求及工作量，并保证开发的功能的稳定性。2.评审测试人员提供的测试用例，并配合测试人员完成测试工作。3.负责模块设计，项目相关的技术文档的编写工作。3.负责项目中主要功能的代码实现，同时参与后期的生产问题解决,1
6,"根据公司发展规划，制定通用性/行业性技术解决方案；""",2
7,熟悉ActionScript编程语言,1
8,负责与业务部门交互沟通，协调研发部门、基础架构部门完成运维需求交付，包括生产和测试环境的搭建和应用版本发布，并提供运维服务报告,0
9,负责日常大客户运维保障支持（重点客户）提供大客户系统服务解决方案，协助业务区市场部电子运单的应用推广,0
10,"数据图表化展示，能够完成前端图表展示开发""",1
11,"具备5年以上WMS或OMS项目实施经历，领导或参与3个以上大中型WMS项目并成功实施,有乙方实施或产品设计工作经历优选",4
12,上网行为规范管理,4
13,参与系统联调测试、用户接收测试方案、测试业务场景或测试用例、测试报告的编写与审核工作,1
14,"""1、根据用户需求完成产品的ID设计",2
15,，实施软件测试，负责编写文本、自动化测试用例及部分测试脚本,1
16,产品持续运营：负责制定相关运营政策（如内容完善、活动策划、促销推广等），达成产品运营目标,4
17,"主动与产品沟通，不断优化测试方法、提升测试效率。""",2
18,协助各研发中心GIT考核验收工作,4
19,具有熟练的编码能力和技术学习能力，且具有创新精神,1
20,善用UML方式表达设计思路,1
21,负责Unity3D产品的系统逻辑3、UI、工具、图形特效的程序开发，协同策划和美术优化改善产品,1
22,支持研发部完成相关系统和设备的测试工作,0
23,"跟进产品运营情况，了解竞品动向，关注市场动态，并提出相应对策和方案。""",4
24,负责公司各业务系统的Linux&Unix操作系统、云平台、docker平台运维、开发工作,0
25,，负责中间件日常运维规划的制定与完善,0
26,"对接业务，负责整理、分析一线业务需求，推动解决推广中遇到的问题；""",2
27,应用系统和数据库资源容量评估、环境交付，性能瓶颈分析及优化,2
28,负责产业园相关智能化设备的需求承接,0
29,"""1、负责国际物流交易平台的产品规划，包括但不限于产品设计、业务流程设计、功能设计、UI界面设计和技术编写开发需求等",1
30,"""1.负责机器人计算机视觉算法和深度学习算法的研发工作",1
31,关注行业发展方向和公司业务趋势，保证公司技术解决方案的市场领先性,2
32,"从需求角度进行需求测试验证。""",2
33,"制定大数据的技术解决方案及规划，理解业务需求，推进大数据的应用。""",2
34,负责制定产品业务规范，撰写产品需求文档及梳理业务流程,2
35,"""1.为客户提供系统解决方案，包括客户需求调研、业务流程分析、产品规划、产品设计等工作，制定并编写解决方案",2
36,４、跟踪存储行业最新发展技术、研究和积累新技术,2
37,负责产品功能维护和改进,0
38,"""1、按照开发规范，标准、规范、严格地进行项目编码开发",1
39,"""1.负责客户处投放热敏打印机安装调试",0
40,"建立场地规划的工作制度与流程，确保日常工作的职责明确化、流程合理化；""",4
41,需求,2
42,负责应用系统重大故障快速诊断及解决，跟进及推动故障改进措施实施；制定系统运行应急方案，并使用应急预案优先恢复应用系统,4
43,负责,0
44,"项目进度控制，与供应商及外协单位沟通技术方案及项目进度；""",4
45,负责需求调研、分析、研发、测试、上线整个需求过程的管控与协调,2
46,独立推动设备生产供应商配件打样、生产进度,4
47,从客户以及经营的维度实施数据分析与挖掘，为业务区经营提供IT技术支持,2
48,"""1、负责视频结构化和行为检测相关算法研究和实现",1
49,"""1、	负责应用环境部署与维护，安全稳定运行",0
50,跟踪项目进度，使用相应bug管理工具对缺陷进行追踪，承担负责项目或模块的质量,4
51,负责专送产品与北京同城平台的对接与开发,0
52,"""1、负责产业园建设和运营过程中网络系统的需求调研、设备规划、安装调试等相关工作",0
53,独立进行相关功能的单元测试、集成联调测试，及时发现问题并修复，以保证质量,1
54,"负责策划组织市场活动，如行业展会、高端论坛等；""",4
55,"构建并设计仓库管理系统的核心功能，输出PRD（产品说明书）；""",1
56,为新入职的同事提供工作所需的技术培训,4
57,负责鄂州枢纽工程实施期间所需各类信息系统、信息基础设施的规划、建设、管理,4
58,嵌入式软件测试用例执行经验,1
59,负责整理和分析客户需求，对其分类汇总和实现预估，提出产品发展计划，总结提炼出解决方案与需求分析报告,2
60,"研究和探索创新的开发思路和最新的前端技术。""",2
61,熟练掌握调试分析、注重代码质量,1
62,负责平衡业务需求和技术资源，主导与技术部门的沟通，助力业务提高效率效能,2
63,对所负责运维的业务的质量，成本和安全负责,0
64,快件分拣中心建设项目的工艺规划需求数据分析，工艺流程分析，工艺规划,2
65,"负责发件工具用户的故障处理，功能支持；""",0
66,"有一定的大数据团队管理及人员协作经验。""",4
67,同销售及客户沟通，确保客户解决方案满足客户需求并被客户接受,2
68,负责承担版本的架构设计、性能及调优工作,0
69,"参与代码review；""",1
70,"探索AI在物流领域的创新应用。""",2
71,，参与平台架构部的语音云平台的架构与设计与研发,0
72,"""1、根据部门需求协助处理日常工作事项",4
73,负责产品开发工作的计划、实施，确保技术的超前性、竞争性,4
74,完成指定的专项工作指标,4
75,负责处理报警，进行日常巡检，实施变更，完成需求,4
76,"负责项目中主要功能的代码实现，同时参与后期的生产问题解决。""",4
77,SupportoperationprocessandcommercialrequirementsinEU,4
78,"完成公司交办的其他工作。""",3
79,负责场地内网络规划,0
80,"负责跨部门协调和沟通，推动业务、设计、开发、测试团队紧密合作，确保项目/产品按时按质完成。""",4
81,"""1、负责运维领域相关产品的分析、规划、设计与执行落地",4
82,根据产品开发规范，完成相关技术文档编写,1
83,熟悉产品项目流程，熟悉视觉设计规范，并且对字体设计有浓厚的兴趣,1
84,"""1.	参与同城DDS任务服务模块的业务研发",2
85,"""一、负责市场调查和分析",4
86,"""1.调研物流行业和市场需求，在充分理解物流行业生态和物流业务流程的基础上，挖掘并梳理目标客户的痛点和需求，并形成产品策略",2
87,"""1.负责通过技术手段和管理手段保证公司WindowsServer7*24小时正常运行",0
88,对接产品客户需求，并形成初步的合作方案,2
89,负责制定并完善团队各项目的开发计划、组织方案设计，并监管开发进度,4
90,维护和升级现有软件产品，快速定位并修复现有软件缺陷,2
91,"""1.负责产品的设计、推进、用户研究、竞品分析等",2
92,"负责iOS技术问题的解决；""",0
93,参与手机客户端软件架构设计,1
94,"""1)独立负责业务系统的模块需求分析、设计、开发与维护",0
95,有强烈的创作欲，充满好奇心,2
96,"""1.负责IOT产品产品需求分解，方案设计和评审",2
97,3年以上软件需求分析经验，有软件开发和大型行业应用软件系统方案撰写经验,1
98,"能够根据要求打造前端组件。""",1
99,"负责android技术问题的解决；""",0
100,对各个项目或系统制定QA质量保证计划，并持续跟踪和更新,4
101,负责公司软件配置管理，如基线管理、配置管理工具（SVN/GIT）运维、使用培训,0
102,"""1、负责公司大型中转场网络、服务器日常运维、设备巡检、远程技术支持等工作",0
103,负责图像处理相关技术的应用开发,0
104,"，对项目总的问题进行跟踪分析和报告，推动测试中发现问题及时合理地解决""",4
105,负责制定模块测试计划、用例设计，编写测试用例、测试执行、Bug追踪和管理,1
106,"负责项目的团队建设、技术选型，总体架构。。""",0
107,负责公司网站、软件系统的开发及维护,0
108,负责系统及相关产品需求分析及架构设计,0
109,根据需求实现系统的分析、设计、编码,1
110,"协助应用升级、网络升级、项目上线和机房架构变动等工作；""",0
111,熟悉Android下Java和C/C++语言间的调用和数据交互,1
112,对版本缺陷及生产缺陷进行回顾分析，改进测试过程，提升软件测试质量,2
113,"""1、充分理解公司发展战略及各部门年度规划，收集和挖掘IT需求，进行合理的规划、分析，形成系统解决方案，并协调资源，推进实施",4
114,"""1.本科及以上学历，精通java语义及技术，7年及以上开发、设计经验",1
115,组织制定、审核职责范围相关管理制度、流程、规范、手册；提供专业意见，并推动实施,4
116,"，良好的学习能力和对新技术的追求精神，良好的团队协作能力，积极主动，乐于接受挑战，能承受工作压力。""",4
117,负责APP产品功能测试和兼容性测试工作,0
118,负责业务模块需求的技术可行性分析和系统研发；2.负责个性化业务需求的技术可行性分析和系统研发；3.负责业务系统的功能模块、数据结构和对外接口的设计与开发；4.对IT部门的产品解决方案在IT内部进行讲解（技能传递）,0
119,参与系统功能验收工作及用户手册、新增产品功能培训资料的编写,1
120,"""1、负责熟悉公司内部的研发框架，对个性化系统需求进行前后台系统研发",0
121,运用hive/SQL做数据挖掘分析，用数据驱动产品改进、业务发展,2
122,"执行测试并编写相关业务文档；""",1
123,"独立推动小型智能工具设计及落地实施。""",4
124,"""1、负责Java后台开发",1
125,"""1、负责android相关需求开发",0
126,负责有关多媒体交互设计方案及特效制作,1
127,配合销售人员和客户进行沟通，及时掌握重点客户的需求，了解客户状态，收集客户信息，开拓客户资源,2
128,精细化分解业务需求功能点，推动高效迭代实现计划,2
129,"对数据中心行业技术发展进行前瞻性研究和运用落地""",2
130,"为公司的网络持续优化提供方案""",2
131,"""1、负责图像检测识别算法研究和实现，包括且不限于打印字体文本识别、人脸识别、目标检测、视频跟踪等",1
132,整合产品需求与数据分析，完成产品设计方案、原型设计及撰写产品需求说明书,2
133,熟练掌握软件工程基本原理，能熟练使用PowerDesigner、Visio、EA、Rose等至少两种建模工具,1
134,"在项目执行阶段，对项目的资源、风险、质量进行总体把控，解决项目的存在问题，推进项目收尾工作；""",4
135,根据上级要求编写符合规范的技术文档及维护手册,1
136,协调业务、技术等资源，推动关键场景验证，为项目决策提供关键依据,4
137,熟练使用Kafka、Elasticsearch、Sqoop、Zookeeper等大数据相关组件,1
138,负责整机成品Bom制作，资料、物料、工装治具等的确认,4
139,"协助系统架构师、研发工程师对需求进行理解。""",0
140,"制定运维流程和规范，沉淀与积累运维实战经验。""",0
141,负责同城产品推广方案的策划与实施,4
142,"""1、负责专送产品与北京同城平台的对接与开发",0
143,"根据项目要求，撰写各种技术文档；""",1
144,跟踪结构件打样生产，工艺试装等工作,2
145,创建开发文档，包括系统架构体系，功能目标，接口定义，逻辑状态等,1
146,协助运筹优化算法工程师进行优化模型的数据对接清洗，代码迭代管理，测试；2.RestFulAPI的搭建，维护，性能调优；3.Kafka框架的使用以及性能调优3.开发测试管理体系的搭建以及维护,1
147,开发程序满足公司内部或客户的个性化功能需求,2
148,参与项目功能需求调研、项目可行性分析、技术可行性分析和需求分析,2
149,技术文档编写、对用户做现场培训、系统使用指导,1
150,"""1、根据要求完成产品硬件设计",1
151,网络运维平台和工具的开发,0
152,参与运营支撑平台、运维系统的需求分析、设计、编码,0
153,组织、推动并梳理各项日常工作及项目工作，保证工作目标的达成及各项工作得到有效执行,4
154,"负责公司平台和产品设计，理解业务需求并配合研发同事的工作""",2
155,负责数据中心各类专项工作的跟进及项目进展情况掌控,4
156,相关经验包括但不限于用户行为分析、关联分析、时序建模、文本语义分析和商业预测等,1
157,"熟悉RocketMq中间件、具备丰富的高性能大并发场景下开发及架构经验优先。""",1
158,"""1、理解集团战略决策，把握产品线的发展方向，并制定产品的发展规划和实施路线图，实现完整的产品生命周期的管理",2
159,"配合测试团队完成产品测试方案及测试用例，协同评估产品测试方案及测试用例的完整性、有效性；""",2
160,"独立完成开发工作，进行模块测试，保证代码的质量。""",1
161,绘制工程图并标注各类尺寸、公差、材料、工艺等要求,1
162,对常用的回归测试用例通过自动化工具实现自动回归测试,1
163,对iOS程序的产品设计，需求分析及性能保障有一定的心得,2
164,梳理优化业务使用集群的流程及规范，使集群使用在资源利用、质量等方面均达到较高水平,2
165,"""1	负责公司各产品前端研发",0
166,负责相关业务系统故障处理,0
167,"""1、根据技术研发计划完成公司系统平台、基础服务组件、接口以及应用主要任务模块的核心算法分析、设计和开发",1
168,"""1、负责手机移动端网页及PC端网页的前端开发",1
169,"""1.负责移动端产品的设计、推进、用户研究、竞品分析等",2
170,指导技术人员开展工作，对系统设计、需求边界、软件开发、验收测试等活动进行进度和质量把控，保障系统的稳定和项目质量,4
171,及时对BUG库中的软件问题进行跟踪修正,1
172,跟踪产品上线运营效果，形成产品分析报告并给出优化建议，最终进行产品优化,2
173,前端页面性能优化,1
174,根据产品提供的需求文档，评审需求及工作量，并保证开发的功能的稳定性。2.评审测试人员提供的测试用例，并配合测试人员完成测试工作。3.负责模块设计，项目相关的技术文档的编写工作。1.负责项目中主要功能的代码实现，同时参与后期的生产问题解决,1
175,负责自动化测试脚本的开发，包括接口、功能自动化测试脚本,1
176,"具备良好的沟通能力和优秀的团队协作能力：""",2
177,参与平台型产品规划，负责产品功能设计、流程设计和用户体验设计与优化,2
178,3年以上J2EE架构的软件开发开发经验,1
179,组织并协调产业园运营中心信息化建设工作，通过信息技术实现、保障、促进、引领企业业务运行、发展和创新,4
180,从各环节（如运力资源、业务时效、业务成本、运营质量、运营效率、运营成本）进行数据分析优化落地，定期输出运营分析报告（例如：系统数据传输时效、航班效率、车辆管理、中转环节等；收货上架及时率、拣货效率、发运及时率、商品信息维护完整率、仓储系统优化等）,2
181,负责产品目标用户反馈及用户数据分析，市场竞品使用分析，提炼或构建产品卖点，并能多维度包装现有产品爆点及核心卖点,2
182,"负责财务公司的信息系统安全管理工作，并持续加强公司信息安全管理。""",0
183,"独立与相关服务商、合作方、渠道方沟通、谈判，推进项目进展。""",4
184,负责与项目经理、开发人员和需求就项目要求、进度和问题进行沟通,4
185,负责APP生产线上问题的分析与沟通工作,0
186,"""1.根据产品提供的需求文档，评审需求及工作量，并保证开发的功能的稳定性。2.评审测试人员提供的测试用例，并配合测试人员完成测试工作。3.负责模块设计，项目相关的技术文档的编写工作。4.负责项目中主要功能的代码实现，同时参与后期的生产问题解决",1
187,5年以上大数据开发/架构经验，并在实际项目中应用落地，有实际的收效,4
188,"负责技术团队的队伍建设。""",0
189,不断调整、优化数据库开发维护规范，并对规范做出相应的解读、培训，规范线上、线下数据库结构、权限及调用；支持各产品线的数据库设计及开发,1
190,"负责部门推广传播渠道的管理运维。""",0
191,协调鄂州枢纽信息系统与顺丰科技、航空公司现有信息系统的对接工作,4
192,"Researchandimplementnovelscientificapproaches.""",4
193,对具体的产品进行性能优化，实现极致的Web页面加载、执行和渲染时间,1
194,"""1、负责iOS相关需求开发",0
195,"负责品牌宣传、产品推广、展示活动等视觉设计工作（宣传海报、易拉宝、宣传册、VI、H5页面等）。""",4
196,"通过专题分析，对业务问题进行深入分析，为业务的策略、产品优化提供数据支持。""",2
197,负责对系统研发过程进行符合性质量监督和检查，对发现的不符合项问题进行记录、跟踪和推动解决,4
198,负责私有云和公有云上网络设计、配置、创建和维护工作,0
199,"参与研发部门技术评估、技术积累、技术难题解决等工作。""",4
200,"""1、负责移动端APP及PC端页面开发，与后台工程师协作完成产品数据交互、动态信息展现",2
201,"对系统的应用运营状况数据进行统计、分析、汇报。""",2
202,"""1、负责公司区域范围内分支网点的日常IT运维工作",0
203,负责推动产品落地实现,4
204,"根据产品和项目特点，提出合理的自动化解决方案，并负责设计和实现自动化测试工具，提高测试效率。""",0
205,收集市场反馈与用户行为及需求，提升用户体验,2
206,"""1.参与数据平台相关的接口设计及业务功能实现",2
207,"""负责Android客户端开发工作",0
208,"负责移动终端产品新技术预研。""",0
209,负责处理及跟进用户的需求和建议,2
210,使用仿真软件对所需运动控制算法、机器人算法进行仿真验证,1
211,"以快递业务为中心，利用先进算法，持续优化产品的用户体验。""",2
212,"解决大数据或人工智能领域出现的核心技术问题。""",2
213,负责深度学习模型的研发，调优等,1
214,"能够在团队中完成codereview的任务，确保相关代码的有效性和正确性，并能够通过codereview提供相关性能以及稳定性的建议；""",4
215,出具详细的产品规则说明书，并讲解和开发跟进,4
216,根据实际需求进行敏捷课程培训,2
217,负责地区运维工作管理及基础设施建设,0
218,/,4
219,"为团队引入创新的技术，创新的解决方案，提升团队整体技术能力；""",2
220,协助研发和业务查找分析系统问题,0
221,熟悉移动平台各类SDK接入流程,1
222,进行自动化测试执行、优化改进，进行测试问题分析、定位、跟踪,4
223,与业务方及商家进行沟通，获取并梳理业务需求,2
224,参与项目全过程，统筹管理研发各阶段问题点，直至所有的问题关闭,4
225,"根据上级要求编写符合规范的技术文档及维护手册。""",1
226,"""1.支持上级工作，负责上级日程管理及差旅行程安排，协助上级做好部门管理及团队融合，参与上级及核心团队的支持工作",4
227,参与公司内部使用的航空行业相关系统的需求分析、系统设计、架构设计、核心编码、系统实施等研发工作,2
228,根据需求设计合理的实现方案,2
229,"""1、负责招标文件审核和商务合同起草和审核",4
230,"""1、完成研发经理下达的研发任务，按研发规范提交最终成果",4
231,负责AD、ADCS、DNS、Exchange等微软基础架构产品运维和技术支持,0
232,四、负责宣传、活动策划、营销推广工作,4
233,"负责产品升级和维护。""",0
234,负责开展审批流程&授权管理方法、标准、模板和工具的优化,4
235,"负责需求管理平台、架构图系统的研发和平台升级优化。""",0
236,"""1.负责公司业务系统主机、数据库、中间件的安全风险评估与整改跟踪",0
237,"""1.	负责对海量数据进行分析和挖掘，发现有价值的信息并驱动产品、运营优化",2
238,负责丰农B2B系统整体的产品规划和功能规划；编写完整的产品需求文档，协助开发团队理解和掌握需求，对产品需求方向和易用性负责,2
239,熟悉JBOSS,1
240,"""1、配合研发业务代码上线版本发布，查看日志分析故障，系统环境配置。线上业务故障处理，线上业务与运维平台API接口对接",0
241,"""1、参与项目系统总体设计",4
242,"""1、根据公司业务战略发展需要，统筹规划全网场地（含各类分拨中心、仓配中心、冷库、营业网点等营运场地）的短中长期规划，协助和推动场地规划方案的落地",4
243,对技术难点公关，配合其他同事解决研发中、线上系统运行的问题,4
244,测试使用,4
245,"协调其它部门完成飞控系统相关的对接工作；""",4
246,"""1、负责无人机控制算法的开发和测试",0
247,根据产品开发需要，完成产品各部分设计的更新和修改,2
248,"""1、负责SAPHR模块日常运维工作，及时解决用户在日常使用过程中的问题",0
249,负责用户需求的挖掘、以及需求的收集及分析,2
250,"参与结构试验，无人机试飞，以及其他临时分配工作。""",4
251,模型结果的验证与落地方案制定,4
252,负责安全产品运营，对收集的安全产品日志进行分析，发现存在的潜在风险并及时推动解决,2
253,"""1、结合公司战略规划和愿景，负责制定车辆资源产品线的产品策略，明确产品路线图，对产品全生命周期进行管理",2
254,挖掘提升测试质量与效率的工具需求，并对工具进行开发及使用推广,2
255,"持续优化和迭代、确保代码的可读性、易维护性和可扩展性。""",1
256,系统规划，与产品人员进行前期调研和产品设计工作，编写调研报告和项目解决方案,2
257,能主动学习，能做好计划管理和进度管理,4
258,"""1、负责大数据Hive开发及数据建模",1
259,精通photoshop、illustrator、flash等常用设计工具，熟悉Html、JavaScrip和DIVCSS等技术，能编写扩展性、兼容性良好的页面结构,1
260,"负责ECP系统的需求管理及落地推广""",0
261,"""1、负责地区IT基础架构支持与管理工作",0
262,根据测试标准和规范、需求分析、用例分析等进行软件测试，能够保质保量按时完成测试任务；2、执行功能测试、性能测试、回归测试等日常版本测试工作；3、设计测试用例，对测试中发现的问题进行及时跟踪和反馈，分析和解决问题；4、完善测试标准和规范，保证软件的良好用户体验。通用技能：1、具备良好的表达沟通能力及合作精神2、具有工作主动性强，善于学习3、具有良好的工作态度和职业道德4、能承受一定的工作压力,1
263,"""1、负责城市内流程试点、验证工作",4
264,"简历、跟踪、维护测试工作的相关文档；""",1
265,负责核心代码的编写工作，并能带领其他成员完成项目的研发工作,4
266,对接UI设计、实现产品界面，与后台开发人员共同完成产品功能,1
267,为行业客户与公司系统对接提供全面的解决方案支持与IT资源协调,2
268,"研究性能测试方法和工具，不断完善性能测试框架，提出公司内性能测试工具和方法改进建议。""",1
269,"""1、信息安全事件调查，提交应用漏洞整改建议和跟进整改",4
270,"研究创新的开发思路和前沿技术，应用到团队产品中。""",2
271,"根据产品功能需求设计并完成软件实现。""",2
272,"""1、根据需求拆分测试点，编写测试计划、测试用例、测试结果等相关文档",1
273,引入新技术及框架，创新并持续优化现有技术架构标准,2
274,根据业务规划，配合实施门店新设备的引进工作，制订选型技术标准，执行选型测试、试点、推广和运行支持,4
