0,,4
275,负责公司相关软件的架构设计、改进、完善，性能优化,0
276,数据库数据整合、ETL及接口开发,1
277,"""1、可独立负责项目研发、运维、落地、推广落地等全流程工作，统筹项目的全面有序按计划的开展",4
278,负责车联网辅助驾驶平台和数据可视化项目的系统架构,0
279,"对流程设计、优化提出建设性建议。""",2
280,负责无人机调试和维护工作,0
281,"协调开发团队与客户，跟踪产品运营效果，形成产品分析报告并给出改进建议。""",2
282,"负责模型算法开发与改进""",1
283,负责产业园建设过程中弱电相关系统的大纲规划、需求提报、图纸审核等相关工作,4
284,"""有强烈的创作欲，充满好奇心",2
285,"突发事件应急响应""",4
286,"""1.负责公司相关系统开发，负责代码编写及代码维护，包括需求分析、功能定义、框架设计、实现、调试、测试",1
287,"""1.负责公司相关软件的架构设计、改进、完善，性能优化",0
288,负责HA架构规划和实施，操作系统整体调优和主动预防,0
289,负责相关网络设备、服务器、存储等设备的规划、部署、配置、调试和管理；负责对公司网点网络的维护与管理,0
290,搭建并维护持续集成测试环境,0
291,"深入跟踪竞对产品，并归纳分析壁垒，为业务规划以及决策提供参考；""",2
292,"""1、负责根据项目测试计划制订项目测试用例并实施，保证项目质量和进度",4
293,负责X86服务器全生命周期运维管理,0
294,"：能引导以及帮助部门内其他同事进行技术提升""",4
295,完善和优化算法，以技术驱动公司业务成长，体现技术价值；负责基于历史数据与实时流数据的分析与策略优化,2
296,"""1、负责项目中与视觉里程计/图像拼接/三维重建相关的算法研究和实现",1
297,"针对顺丰优选线上线下业务系统，提供功能支持和技术支持，承接各类IT异常并跟进问题及时解决，持续收集和挖掘优化点并推进系统改进。""",2
298,"""1、负责顺丰国际业务的应用运维工作，包括应用系统日常例检、监控、和主动预防工作",0
299,负责对全网地区IT提交的需求进行跟进并跟踪直到需求行到落地解决,4
300,人资领域的需求分析和产品设计（解决方案设计），出具相应的文档,2
301,"负责对相关技术文档，以及在研发过程中产生的记录性文档，进行拟订""",1
302,负责产品各功能模块驱动设计和开发调试,0
303,"""1、主要负责iOS应用程序的设计，能独立完成开发工作，至少开发过一款完整的iOS产品",1
304,熟悉多线程技术，并有相关开发经验,1
305,推动算法、研发、测试团队保证产品按时发布，并根据一线反馈不断迭代,2
306,制定各种项目管理计划，并监控追踪项目实施,4
307,"""1、负责产品定义、搜集和提出产品需求",2
308,"""1.调研和搭建适合海量数据的存储、统计、分析和深度挖掘的系统架构",2
309,配合前端开发人员进行应用及系统整合，积极配合UI设计师和产品策划人员研究并改善用户体验,2
310,"""1、	负责用户需求调研和行为分析，绘制产品原型图，输出PRD",2
311,"""1、负责公司业务系统网络环境及设备的管理、配置、排错、维护，提供网络设备维护方案",0
312,"，参与平台架构部的公共组件的设计与研发""",0
313,"新包装创新方向的提报和论证。""",4
314,负责SFSRC的漏洞审核、跟踪，并协助业务部门制定解决方案,4
315,"""（1）参与系统需求分析，进行概要设计和模块的详细设计",1
316,参与应用服务系统的整体规划、架构设计及优化等工作,0
317,"负责管理产品的体验，跟踪产品的体验效果，持续改善产品的用户体验，不断改进产品功能""",2
318,"""1、统筹H线项目管理工作，负责把控项目的过程、质量与汇报",4
319,在按照需求完成编码开发工作的前提下，能通过大数据量压力测试,2
320,洞察物流行业技术的未来趋势，规划出有竞争力的新特性、新机会点和前瞻性的场景化解决方案,2
321,"""1、根据产品需求，使用QT库，构建界面框架、完成界面逻辑",1
322,"完成网络规划模型所需的数据分析工作，负责运筹优化方向的算法研究和开发；""",1
323,进行供应链协同产品的规划设计，并对现有系统提出改进建议,2
324,"""1)根据产品的实际应用场景，进行调研和准确解读，完成产品的工业设计及独立提案，并将设计或者提案形成完整的文档",2
325,"""1.根据产品设计需求，配合后台开发人员实现产品界面和功能，维护及优化前端页面性能",1
326,"开发并维护相应的数据库操作文档。""",1
327,能够制定开发管理规范，并指导团队成员执行,4
328,"负责日常的运营活动及功能维护提供设计支持。""",0
329,"""1、运维顺丰全网Linux&unix操作系统，保障操作系统稳定、安全、高效",1
330,"主动输出并跟进各相关模块的问题及落地改善""",4
331,负责公司办公环境的软硬件和桌面系统的日常维护确保公司办公场地日常的正常运作的日常运维,0
332,"""1.对手机终端系统、网络、图形界面、UI框架以及网络交互有深入理解",1
333,负责Linux平台系统的安全管理,0
334,"""1，负责中间件平台，如：Jetty、Tomcat、Redis、Nginx/Openresty、Haproxy、Kafka、RabbitMQ等的日常运营",1
335,"""1.负责客户网站、专题等网页设计",1
336,负责处理系统整合过程中遇到的问题,0
337,对关键构件、接口进行设计，撰写系统设计方案,1
338,对机器人传感器信号进行处理，开发机器人环境感知算法和相关代码编写,1
339,"""1、负责建立数据运营底盘基础，包含数据内容规划（指标、纬度）、数据采集埋点规范标准制定等",4
340,熟悉Hadoop生态圈常用组件,1
341,"""工作职责：",3
342,"""1、负责同城产品运营支持，包括产品推广及推广运营监控工作",0
343,"负责自动化项目的验收及系统交付；""",0
344,"""1、	根据丰农战略业务定位，负责丰农B2B系统研发及运维管工作，为丰农商流工作提供系统支持，提升丰农服务运维水平",0
345,负责项目中协调各项目参与部门的协作和冲突，能及时发现并提示项目风险和问题，组织制定应对或规避方案至风险和问题的解决,4
346,"支持融合感知、规划控制、地图构建等相关模块研发工作。""",1
347,"""1、负责无人机控制系统的代码编写",1
348,能够推动企业内部职能部门流程优化的项目,4
349,参与鄂州枢纽项目弱电信息系统建设工作；包括设计、施工阶段的各项建设工作,4
350,"负责解决系统线上故障，负责优化业务和系统问题""",0
351,"""1、负责机房及服务器运维平台、工具的自动化开发",0
352,带领项目组内初级人员开展工作,4
353,熟悉Hbase，理解hbase理解Hbase的存储原理和存储架构,1
354,提升前端页面交互和使用体验,1
355,"负责项目开发的流程设计、模块整合、性能测试与算法优化等""",1
356,"""1、负责质量管理体系搭建",0
357,具备物流详情信息、数据的整合能力,2
358,围绕大数据在服装、快消、生鲜、3C等行业的应用场景，对行业、市场、用户及竞争对手等方面编制分析报告,2
359,"""1.统筹H线项目管理工作，负责把控项目的过程、质量与汇报",4
360,负责行业、竞品的相关研究分析,4
361,开发与完善内部自动化运维工具，提升运维质量及效率,0
362,，负责中间件平台的故障定位与异常处理,0
363,根据软件设计需求定制测试计划、设计测试数据和测试用例,1
364,"""1、对市场研究/销售管理/销售支持/价格管理领域软件有较深理解，有相关实际软件项目研发或实施经验",4
365,合理地引导业务的需求，给业务提供端到端的解决方案,2
366,"持续研究前沿技术并应用到产品中。""",2
367,工作内容包括但不限于航空资源与线路规划、干线资源与线路规划、路由规划，配载优化等,4
368,"""1、对于平台运营中拉新、留存、促活、转化，找出关键痛点，提出不断优化的设计方案",2
369,根据项目实际情况对项目成员提供相关敏捷实践的培训和指导,4
370,"""1、负责货圈全用户产品、商户产品、内部系统等核心系统的多渠道前端实现",2
371,"管理团队的发展规划和计划，制定团队/项目的管理工作，对团队成员进行考核激励。""",4
372,"规范和文档的编写、维护""",1
373,"""1.负责Android应用研发工作",0
374,"负责运维研发质量体系建设，可担当团队敏捷教练角色；""",0
375,"研究跟踪最新安全漏洞检测、评估影响并提出修复方法；""",4
376,开发合适的供应资源，及时整合供应资源,2
377,参与系统应急方案的定期演练，执行应急方案，提出优化方案建议,4
378,"能够持续地对产品进行性能调优""",2
379,"有良好的团队合作能力和学习能力；""",2
380,"负责公司大数据平台的规划、选型、搭建，以及平台的维护和优化,制定清晰的大数据技术路线图",2
381,协助顺丰科技完成各项IT项目或专项工作落实,4
382,"能快速定位并解决程序错误。""",4
383,案例(businesscase)编写，确保方案的可实施性及经济可行性,4
384,负责H线产品的需求确认、目标用户与干系人分析,2
385,"编写新产品导入所有相关技术标准文档；""",1
386,负责IT项目实施、故障调查、技术分析，并提供解决方案或建议,4
387,"""1.产品研发项目过程跟进",2
388,负责优化应急响应流程和突发事件的应急响应,4
389,负责应用日常监测、故障处理、参与性能分析与优化,0
390,负责模块设计，项目相关的技术文档的编写工作,1
391,参与系统功能验收工作及负责用户手册/新增产品功能培训资料的编写,1
392,负责总部数据中心机房运维及管理,0
393,"""1.产品需求挖掘及收集：负责内外部产品调研分析，根据调研结果，形成产品规划意见提出明确产品需求",2
394,负责应用运维平台建设，制定应用系统运维管理相关规范和制度,0
395,对接集团日常行政事务沟通，协调处理等，包括不限于场地、餐饮、清洁、安防等,4
396,"运用用户分析、数据分析等方法提升产品效果""",2
397,"能够主动结合全网基础架构的情况，提出符合信息安全的架构方案，并推动方案的落地实施""",4
398,"进行Android客户端技术和业务的探索性预研""",1
399,实施软件测试，针对后台服务和系统进行自动化、功能、性能和安全等方面测试,1
400,"""1、根据公司战略发展的需求，制定公司技术层面的发展规划",2
401,定期输出产品运营体检报告，协助相关产品经理推动落地优化改进措施,4
402,"组织指导业务开发团队，提升业务开发团队技术能力、技术标准、研发规范和研发质量。""",2
403,"前沿深度学习视觉算法的跟踪、实现与优化。""",1
404,"""1.	负责高性能、高并发服务平台的架构设计",0
405,参与项目的需求、设计、编码、测试等流程,2
406,"""1.负责可视化编程编辑器搭建和界面设计",1
407,"负责移动客户端开发团队的建设提升工作，指导团队内开发工程师，完成研发任务，提升团队技术能力和工作效率，帮助团队成长发展。""",2
408,负责相关行业线各类宣传材料的撰写，产品彩页、软文等,4
409,熟悉常用的数据结构和算法，熟练掌握Java、Scala，对JVM性能调优,1
410,根据公司IT规划，进行信息技术中心内部IT项目的过程跟踪和管控，保证项目的顺利进行,4
411,"""1、负责顺丰同城产品运营支持，包括产品推广及推广运营监控工作",0
412,熟悉Linux操作系统，熟悉Shell脚本编程及常用Linux系统管理命令,1
413,"负责解决产品中存在的技术难题，保证系统稳定可靠运行。""",0
414,"根据公司实际情况制定合理的敏捷推广策略""",4
415,负责系统及相关产品需求分析及架构设计，性能优化,2
416,"５、参与并跟进开源社区，进行开源技术的预研""",1
417,"""1.负责熟悉公司内部的研发框架，对个性化系统需求进行前后台系统研发",0
418,"产品开发过程中技术平台积累，包括技术规范、通用技术模块、经验案例、科技论文的撰写.""",1
419,"需求信息的记录、收集、反馈，技术文档的编写，系统使用指导。""",1
420,"平面印刷宣传类设计""",1
421,根据公司开发规范，标准，规范、严格地编写高质量、可维护的代码,1
422,技术文档、操作指引编写、对用户做培训和使用指导,1
423,"实施对系统的环境搭建、集成测试、系统测试、用户测试、性能测试,提交测试报告",1
424,编写底盘相关功能测试用例并执行相应测试验证,1
425,利用运筹学、大数据分析、智能算法等手段建立并优化场地规划的标准、模型和系统，提升场地规划工作的技术水平,2
426,"""1、负责相关业务系统技术支持",0
427,负责指导、处理、协调和解决公司项目中出现的技术问题,4
428,"根据业务需求进行CRM、BI系统开发和问题处理，包括系统界面、报表和数据间接口的集成；（如：ERP、CRM、PDM、MES、OA、HR等系统数据间的集成）。""",1
429,"""1.收集、梳理和分析企业内部用户或外部业务伙伴和客户（外部用户）的业务需求",2
430,"""1.建设业内领先的大数据平台，大数据解决方案",2
431,负责缺陷跟踪和管理,4
432,"""1、负责无人机（固定翼和多旋翼）的飞行测试工作",0
433,实施对产品的集成测试、系统测试、用户测试、性能测试，提交测试报告,2
434,"""1.	负责计算机视觉、模式识别相关项目的算法研发",1
435,"""1、有扎实的JAVA技术基础",1
436,"""1、负责业务系统生产环境审核，执行生产环境变更及发布实施，发布后协助用户对系统新功能进行验证",4
437,配合测试人员编写测试计划、测试用例、测试报告的编写、问题缺陷的发现及跟踪、产品用户手册编写等,1
438,负责项目管理的日常工作，包括进度、质量、风险及变更管理，及客户满意度提升等,4
439,"""1.负责流式数据处理的工程实现和落地，包括海量数据的计算、存储和检索",1
440,"自动化测试：能够熟练使用至少一种主流自动化测试工具或性能测试工具（Loadrunner/Jemter&Selenium/RobotFramework尤佳）。""",1
441,定期检查和分析全区所有IT软件硬件设备资产及配置标准，并提供相应的服务支持和优化建议，保证设备在各岗位稳定、高效的运行,0
442,"基于产品运营数据、用户行为数据的采集、监控和统计分析等，提出可执行的优化策略，制定产品的迭代更新计划。""",2
443,负责和相关服务商、合作方、渠道方沟通、谈判，推进项目的进行,4
444,"评审测试人员提供的测试用例，并配合测试人员完成测试工作，保证项目质量""",1
445,"""1、负责运维工具开发",0
446,编写测试用例并执行测试,1
447,配合业务需求，与其他业务系统进行接口开发,2
448,按照开发流程编写相应模块的设计文档,1
449,"处理用户IT问题并实现IT需求；""",2
450,负责机器视觉检测项目的算法设计和程序开发,1
451,"活跃的工作态度,有团队合作精神，对新技术有好奇心，能够主动进行技术钻研，并带动和提升团队技术能力。""",2
452,持续的优化和改进已有业务系统，进行日常需求维护和二次开发工作,2
453,对APP应用代码段进行重新架构,1
454,"""1、负责从视觉和操作层面对公司软件界面进行设计工作，根据产品需求，对产品的整体美术风格、交互设计、界面结构、操作流程等做出页面内容的设计、开发、及维护",1
455,对适合自动化测试系统编写测试脚本，实现自动化测试,1
456,"""1、负责无人机整机产品的新产品导入，对接研发和工厂",2
457,熟悉市场上资金类系统的最新发展动态，主动与供应商联系，了解功能与优缺点，结合我司实际提提供意见或建议,2
458,Analyzeandextractrelevantinformationfrombusinessdata/userbehavioraldatatohelpautomateandoptimizekeyprocesses,4
459,紧急故障外勤（现场服务器及网络维护）,0
460,负责涉及网点的IT专项工作推进和完成,4
461,对现有系统架构和数据模型进行改进优化，以适应未来业务量的发展,2
462,"""1、用系统化的方法分析业务变化趋势，为管理层决策和产品完善提供数据支持",2
463,通过数据对销售、BD、用户消费习惯数据进行深度分析挖掘。为BD、销售、物流优化提供深度的优化建议,2
464,结合产品特性，提出有效的运营策略及执行方案，对部分结果负责,4
465,根据业务需求完成产品的原型设计、交互设计和流程设计，产品需求文档、操作手册撰写等,2
466,进行设计规范的输出，并推动规范在整个项目团队执行,4
467,通过海量的数据实施用户画像、风险防控、文本挖掘、预测、时间序列等项目,2
468,编写APP需求开发文档,1
469,指导技术团队完成产品实现，并保证产品质量,2
470,负责产品量产支持和维护,0
471,实施对产品的集成测试、用户测试、性能测试，提交测试报告,2
472,负责招投标过程中，商务合同的审核，保密协议签订,4
473,有前瞻性的，敏锐的产品思维，产品方法论，产品实际管理及落地经验，关注行业发展，持续开展市场调研，敏锐把握产品行业动脉，聚焦用户痛点，高效实现产品转化,2
474,，负责中间件组件运维工具开发，进行自动化运维平台建设,0
475,"根据部门要求给图像拉框标点、添加描述信息等；""",1
476,，参与平台架构部的微服务架构设计与研发,0
477,"对地区执行中遇到的问题进行反馈并提出解决方案""",4
478,"部分软件功能模块设计和软件界面美化。""",1
479,测试执行：能够按照测试方案和用例执行测试工作，并能够遵照缺陷管理规范中的要求进行缺陷的管理、对缺陷的变化曲线及具体的缺陷类型的分布进行深入的分析，给研发员提出建设性的改进建议,4
480,"搭建控制系统平台，并进行算法核心代码编写。""",1
481,"""负责数字化产品APP的架构设计、开发",0
482,"基于海量数据和真实需求，使用人工智能/机器学习/运筹学等手段，为新产品开通决策提供技术支持。""",2
483,负责需求管理系统（JIRA）的运维：权限管理、需求流程配置、报表数据监控等,0
484,"支撑DDS同城业务推广，分析解决生产问题。""",2
485,"负责核心框架功能的设计和开发。""",1
486,"通过技术手段控制和优化成本，提升资源使用率。""",2
487,掌握常用设计软件，以及原型Demo制作工具，具有一定的用户界面设计能力,1
488,"制定模型在不同场景下的应用标准与使用指南""",1
489,"根据团队实际情况导入相关敏捷方法实践；""",4
490,学习和研究新技术以提高自动测试的效率和质量，组织兴趣小组，参与公司创新及技术预研项目,4
491,根据用户需求和架构设计文档按时完成开发工作，并保证开发的功能的稳定性,1
492,"负责撰写或审核公司信息系统的部分运维文档和管理文档，如系统安装、配置文档，系统维护手册，用户使用手册，FAQ，应急切换文档等；""",1
493,配合研发工程师样品的采购,4
494,准确把握项目目标和周期，与业务及开发部等合作部门沟通协调，推进项目的顺利进行,4
495,"""1、负责嵌入式系统的代码编写",1
496,"""1、负责上线安全测试、例行安全检查、渗透测试工作",0
497,具备良好的问题定位分析能力，负责解决系统的技术难点,0
498,负责相关业务的数据梳理以及流程优化，配合项目团队完善数据指标体系建设,4
499,解决客户在使用我司内部发件工具的的问题,2
500,"""1.依据产品需求完成高质量的Web前端页面开发和优化",2
501,产品包装的可行性分析与测试,4
502,跟进学习最新的无人机控制算法,1
503,"通过数据对销售、BD、用户消费习惯数据进行深度分析挖掘。为BD、销售、物流优化提供深度的优化建议。""",2
504,"必要时参与移动端产品的功能测试；""",2
505,参与设计和优化应用服务系统的监控系统、策略和实施；配置监控、日志等运维平台，实时监控线上业务情况,0
506,"""1、负责研究制定技术发展路线和移动架构",4
507,编写完整的产品需求文档，协助开发团队理解和掌握需求，对产品需求方向和易用性负责,2
508,"""1、	设计数据/仿真产品，带领团队完成产品研发和实现，负责产品的应用推广和迭代更新",2
509,"（3）参与并完成维护系统问题及故障解决，维护系统软件修改。""",0
510,"""1、主要从事无人机地面站软件研发工作",0
511,"""1、负责建设公司大数据平台，为公司用户提供稳定、易用的大数据平台工具和便捷、酷炫的数据产品",2
512,设计技能全面，对设计有热情，对设计趋势有自己的见解,1
513,配合后台开发工程师一起研讨技术实现方案，进行应用及系统整合,1
514,"探索深度学习等前沿技术在财务方面的应用；""",2
515,协助需求和研发部门对运营支撑系统的结构设计和数据展现,2
516,负责iOS企业和AppStore应用发布，了解产品关键词，能够根据用户反馈，持续进行产品优化,2
517,负责执行分布式系统的发布工作,0
518,负责企业需求管理工作，包括需求管理、需求分析、研发跟进、实施跟踪、上线辅助等相关内容,2
519,负责应用系统的监控部署，从系统逻辑、接口功能、业务功能等角度进行分析，深入理解系统应用，提升应用的稳定性，可用率，不断提升可运维性,2
520,"""1、统筹中心关键产品的运营监控体系建设",4
521,通读过mycat等数据库中间件产品源代码优先,1
522,定义车辆底盘相关功能需求以及验收标准,2
523,"负责为用户提供IT类技术咨询；""",0
524,梳理优化业务使用集群的流程及规范，使平台在资源利用、质量效益等方面均达到较高水平,2
525,定期收集内部业务需求和外部市场需求，评审并输出产品方案，制定航空物流产品解决方案或计划,2
526,，根据产品和项目特点，提出合理的自动化解决方案，并负责设计和实现自动化测试工具，提高测试效率,0
527,负责量产产品内置测试软件设计和开发调试,1
528,参与系统应急方案的定期演练、执行应急方案，提出优化方案建议,4
529,负责服务平台产品的研发和平台升级优化,2
530,负责公司区部、各个场地新建、弱电、网络设备、线路安装调试和故障排除,0
531,负责公司分布式业务系统的升级发布、日常运维,0
532,承接个性化业务工具的开发与应用；2、从客户以及经营的维度实施数据分析与挖掘，为大区经济圈提供IT数据运营分析支持；3、IT与业务融合需求的挖掘与有效输出；4、助力方案+项目落地以及个性化解决方案研究,2
533,"协助完成全球供应商流程管理及谈判，推动项目进展。""",4
534,精通SAPHR前台操作与后台配置,1
535,"深入了解货主和承运商的诉求和痛点，提出新的产品和服务需求，丰富平台产品和服务能力""",2
536,"产品的持续改进与优化；""",2
537,"""负责搭建公司授权审批管理体系，指导各业务部门开展授权审批管理工作",4
538,"""1、负责对本区基础架构设施，机房，分布式系统和网络筹建以及现有基础架构设施的每日检查",0
539,"基于市场销售情况，分析、判断各产品的生命周期及后续的跟进措施；""",2
540,负责地区网络运维工作支持与管理，负责与数据中心网络组共同制定符合全网地区的网络标准规范，并推动标准化工作的落地执行,0
541,对项目的全过程进行组织、协调和管控,4
542,负责梳理前后端系统的架构，负责对整个软件架构、关键构件、接口的设计，指导各开发小组人员进行开发,0
543,配合产品进行界面优化设计，提高产品美观和用户体验,2
544,"协助业务系统规划与设计工作，对应用架构和数据库系统提出合理建议；""",0
545,"""1、理解业务目标、策略，负责业务需求的调研、分析和确认",2
546,"推动质量管理工具的优化。""",2
547,"""1、对交互设计过程有深入的了解，可以独立完成整个设计过程（交互流程、角色模型等等交互设计方法能熟练应用）",1
548,根据产品需求，编写技术方案，实现业务系统编码和自测工作,2
549,负责跟踪项目开发、测试和实施进度,4
550,完成规定的版本研发，按研发规范提交最终成果,4
