0,,4
551,"""1、协助顺丰智能中转设备、工具的设计规划工作（含机械设计、电气设计、自动化控制等）",0
552,"""我们需要你：",4
553,"""1.参与产品需求、系统设计的评审工作，并提出改进意见",2
554,跟踪、监督需求开发的进度，参与新系统的测试与推广，跟进现有系统的使用情况,4
555,"""1、根据用户需求及业务流程，完成系统产品的功能设计，能够满足实际业务场景",2
556,"公司安排的其它工作；""",4
557,"""?	负责自动驾驶视觉感知任务开发",0
558,评审测试人员提供的测试用例，并配合测试人员完成测试工作,1
559,"关注和掌握物流行业物流详情的应用场景""",2
560,"负责各类测试工具的预研和工具平台建设。""",0
561,"上级领导交办的其他工作任务。""",3
562,根据产品提供的需求文档，评审需求及工作量，并保证开发的功能的稳定性。2.评审测试人员提供的测试用例，并配合测试人员完成测试工作。3.负责模块设计，项目相关的技术文档的编写工作。4.负责项目中主要功能的代码实现，同时参与后期的生产问题解决,1
563,"完成上级交付的网络设备和服务器设备的维护、测试、部署、管理。""",0
564,"部门内的安全知识和技能的培训与普及。""",4
565,"""1、负责产品维护敏捷开发和研发项目的项目管理工作",0
566,设计测试流程，分析使用行为及需求，收集反馈，不断对产品进行优化和改进,2
567,负责数据中心的容灾体系建设及年度演练工作,0
568,"无人机监控系统软件开发。""",0
569,能够全面掌握需求，及时处理项目成员对需求的咨询及疑问,2
570,负责机载航电系统的软件接口定义和硬件驱动开发,1
571,负责解决产品在各种浏览器及webview下的兼容,1
572,"负责App的性能优化。""",0
573,推动项目过程中有效的敏捷工程实践，通过教练或顾问的方式协助项目团队解决遇到的相关问题,4
574,"参与H线产品运营，负责监测、整理与分析系统运营数据，并给出优化对策；""",0
575,配合产品经理和UI设计师，研究并改善用户体验,2
576,能充分理解软件设计师提出的设计方案和计划,1
577,负责规划产品运营策略和方向，制定计划，推动计划执行并最终达成目标,4
578,"负责建立数据评测体系，对数据质量进行验证""",2
579,跟进并推动开发、测试等人员紧密合作，达成项目目标，协助编写测试用例和解决测试问题，制定上线切换方案,4
580,"""1、负责顺丰优选门店系统的产品定义、搜集和提出产品需求，并进行相关产品流程设计、功能设计和产品迭代",2
581,"""1、负责公司Android产品的架构设计、开发、优化等相关技术研发工作",0
582,负责产品的持续优化和运营，不断提升用户体验,2
583,对系统存在的问题进行跟踪和定位并及时解决,2
584,"""1、总体负责项目的测试工作，总体了解需求，并根据开发计划和设计规范编写测试计划、测试方案、测试用例、测试数据",1
585,带领团队对于业务数据进行分析，设计并应用数据挖掘相关的算法,2
586,"算法验证：能够有效验证算法模型的可行性，并不断丰富业务场景，优化算法模型""",1
587,制定产品说明书，对产品的设计、开发、测试、上线等过程进行全程监控,2
588,监控门店设备和软件运行状态，排除潜在风险，持续优化各类技术策略和标准，确保业务稳定开展,2
589,"""1、负责数据中心内部流程制度建设及优化",0
590,产品跟踪优化：收集反馈和新的产品需求，形成优化建议方案，推进产品优化的落实和相应产品指标的跟踪达成,2
591,负责为地区IT提供机房基础环境运维、X86服务器硬件相关技术支持,0
592,负责机房运维及管理工作改善及优化,0
593,参与技术难题攻关、组织技术积累、有较强的钻研精神，自学能力强,4
594,负责IT服务中心运维自动化、运营系统的开发与管理，打造可编程的基础架构,0
595,负责开发、完善运维内部系统及辅助系统，提升运维质量及效率,0
596,熟悉软件工程，对设计模式及UML有一定了解,1
597,"完成上级主管指派的其它任务。""",3
598,负责统计、汇总项目和相关工作报告，有效地组织召开相关会议，做好项目总体计划进度报告、阶段性汇报及关键里程碑的项目汇报,4
599,"负责服务平台集群式架构、部署方案以及监控""",0
600,负责研发组件化、模块化、平台化架构和设计，并进行不断设计和架构优化,0
601,"""1.负责公司内部所有相关行政事务，包括场地管理，座位规划；会议室资源协调等，办公环境监督等",4
602,参与算法架构设计及其在各个平台的移植和优化,1
603,"负责项目中主要功能的代码实现，解决生产环境中出现的各类问题；""",4
604,对项目进行风险评估，制定应对策略,4
605,负责信息系统对上、下游接口标准设计，输出上、下游对接标准API,1
606,"""1、负责客服系统前端架构设计、开发与优化",0
607,"架及运维；设备清单整理；""",0
608,负责运营数据分析和回顾并对整个网络进行优化,0
609,"负责U3D开发团队技术管理""",0
610,负责无人机电机控制器物料选型、BOM制定及其量产工作,0
611,"""1、负责企业办公客户端产品功能规划、设计和产品生命周期管理",2
612,负责与相关部门对接，制定和执行新产品、新功能的落地实施计划，确保产品高效投入外部市场以及内部业务体系,4
613,负责北京AI团队建设，技术研发管理；带领团队攻克难题，吸引更多优秀的人加入,4
614,"解决开发过程中遇到的技术问题，配合项目成员完成相关测试工作。""",4
615,团队配合，参与HTML5应用架构的设计和规范化工作，优化代码实现，提高产品性能,1
616,参与项目业务方案设计，能根据需求分析文档编制接口解决方案和开发说明书,1
617,"WorkasafrontlinesupporttoperforminitialdiagnoseinITrelatedissues,identifyrootcauses,coordinatew/relateddepartmentstocomeupandimplementresolutionswithrelatedparties",4
618,"提出新的产品思路，调整方向，打磨细节""",2
619,掌握工艺方案规划、机械设计等工作的专业知识技能,1
620,"负责WindowsServer运维管理自动化开发和支持工作。""",0
621,"有APP/Web网站设计成熟的项目案例，或有交互设计、UED经验者优先。""",1
622,对测试中发现的问题能够进行分析和定位，与开发人员、需求人员积极有效沟通，推动问题解决,2
623,"评审测试人员提供的测试用例，并配合测试人员完成测试工作，保证项目质量。""",1
624,负责高层设计，项目相关的技术文档的编写工作,1
625,带领并指导开发工程师进行代码开发/单元测试等工作，保证代码的健壮性、可读性、易维护性,1
626,根据产品提供的需求文档，评审需求及工作量，并保证开发的功能的稳定性。2.评审测试人员提供的测试用例，并配合测试人员完成测试工作。3.负责模块设计，项目相关的技术文档的编写工作。2.负责项目中主要功能的代码实现，同时参与后期的生产问题解决,1
627,负责研发中心的项目立项、结项等项目过程指导相关工作,4
628,"""1，参与平台架构部的大客户发件系统的设计与研发",0
629,"""1、参与软件需求的开发及评审，深入理解业务逻辑及运用场景，负责将软件需求转换成测试用例",1
630,具备良好的审美能力和手绘功底，具有较好的创作型思维和逻辑思维，所有设计的原创性需要达到90%以上,1
631,"规范文档的编写、维护，以及其他相关工作""",1
632,"""负责丰声大数据数据库搭建，数据表对接",0
633,熟练掌握分布式通讯、缓存/存储、并发编程、服务框架、性能调优.,1
634,测试执行：能够按照测试方案和用例执行测试工作，并能够遵照缺陷管理规范中的要求进行缺陷的管理、对缺陷的变化曲线及具体的缺陷类型的分布进行深入的分析，给研发人员提出建设性的改进建议,4
635,"协助顺丰科技编写系统应急方案，定期进行应急演练，执行应急方案，并提供优化方案建议""",4
636,"完成上级交办的其他工作任务。""",3
637,按照相关流程规范输出软件过程中的各种文档,1
638,负责需求调研、分析，统筹设计系统需求解决方案，推动需求的开发、测试和上线,2
639,"""1.统筹地区个性化需求的受理与评审工作",2
640,"完成领导交办的其他工作。""",3
641,（2）负责子系统/子模块功能的开发及测试,0
642,保证项目的正常进行，确保公司项目计划按时完成,4
643,"完成上级交办的设计相关事项。""",3
644,负责产品APP的架构设计、开发,0
645,做好鄂州枢纽项目信息系统的项目管理工作，计划制定、过程控制、资料管理等,4
646,针对公司不同产品的实际情况，对研发流程进行裁剪并监督实施,4
647,"""1、根据产品需求，进行需求分析评审、详细设计、技术文档编写",2
648,"预研前端技术方向，提高前端团队整体技术水平。""",2
649,"制定IT运维标准及流程管理优化""",0
650,"""1.	负责团队内多个项目进度节点把控，和资源调度",4
651,参与对供应链物流协同平台的产品设计，包括供应链计划、供应链执行、S&OP、订单管理、运输管理、库存管理等,4
652,参与模块设计、子系统交互、数据交换等业务无关基础架构设计,1
653,"解决各种疑难杂症,系统优化，帮助系统架构完善",0
654,"对地区执行中遇到的问题进行反馈并提出解决方案。""",4
655,定期针对特定产品案例，进行市场调研分析并输出反馈报告,2
656,"部门安排的其他任务""",4
657,"自动化测试：能够熟练使用至少一种主流自动化测试工具或性能测试工具（Loadrunner/Jemter&QTP/Selenium/Cucumber/RobotFramework尤佳）。""",1
658,参与整个产品的生命周期管理，根据用户分析、行业需求制定产品更新迭代方案，提升产品竞争力,2
659,"参与分享设计经验，提高团队的设计能力""",2
660,负责IT项目实施、公司内部系统安装，调试，维护；系统日常监控、数据备份、恢复；现场或远程解决公司内部IT问题,0
661,"""1.	负责研发项目的物料采购，高效支持研发工程师物料",0
662,负责策划线上/下活动，进行产品推广，不断加强商户使用粘性、同时激活新用户,2
663,，负责项目的测试方案制定，设计测试数据和测试用例,4
664,能制定技术标准规范，并高质量完成设计、开发任务,1
665,"负责解决开发过程中的技术问题。""",0
666,"Otherdutiesasassignedbysupervisor""",4
667,"""1.负责数据类测试工作，白盒测试、自动化测试，独立设计和执行设计用例，进行缺陷跟踪等",4
668,带领技术团队完成产品各模块概要设计和详细设计，提升开发效率,2
669,负责研究IT系统运维主动预防工作，如系统运行监控预警、系统运行预测评估、应用容量监控和预测，建立和实现系统运行主动预防体系,0
670,"""负责产品在iOS平台的客户端开发工作",0
671,对日常数据进行跟踪和研究，进行产品或功能上线效果分析，并跟进改进产品的体验完善,2
672,"""1.根据运营策略执行产品线上线下活动，推动产品应用落地",2
673,"指导与支持产品经理、业务经理设定目标，并检验是否达标。""",4
674,测试计划：能够对负责的测试任务准确的进行工作量的估算，以及制定较合理的测试计划,4
675,按照开发流程规范，进行项目编码开发、单元测试、集成联调测试等，确保质量,1
676,"跟进产品运维、迭代项目管理，确保目标达成。""",4
677,嵌入式系统软件测试或开发经验，3年以上（开发测试经验不必同时保有）,1
678,和技术组对接，跟进UI设计，推动项目上线,4
679,"""1、负责IT运维平台的建设，通过引进/自研等方式实现IT运维支持平台工具化、自动化、智能化",0
680,"""根据公司战略规划，开展呼叫中心",4
681,负责大数据产品的规划和实施，对产品进行可行性分析及设计，完成产品设计、编写产品需求文档、和各方进行有效沟通,2
682,"负责各类型场馆的触摸屏，多点触摸桌，互动墨镜墙等互动展项的程序编写，动态效果设计""",1
683,"""1、顺丰总部数据中心网络的规划、建设和运维",0
684,"""1.负责APP开发工作",0
685,"负责在项目推进过程中的跨部门协调沟通工作，确保产品及新功能能按时完成并高质量上线""",4
686,设计、开发高可用、高性能的REST接口，满足高内聚、松耦合、可维护等要求,1
687,"能积极与开发沟通，推进界面及交互设计的最终实现。""",1
688,"""1、负责部门产品功能规划、设计和产品生命周期管理",2
689,负责对个性化系统的数据库进行设计,0
690,开发敏捷相关课程,1
691,"""1、计算机或软件相关专业,4年以上工作经验，全日制本科或以上学历",1
692,试产跟进、试产总结、试产问题点改善，组织召开试产会议,4
693,负责投入产出分析，并根据分析结果完成设计提升改善，以推动方案的实施落地,4
694,协调开发团队及项目管理，日常进度跟踪以确保产品功能特性和交互符合产品需求文档的要求，同时根据行业发展和市场需求，制定产品中长期规划，有效整合可用资源，保证产品的可持续性健康发展,2
695,熟悉J2EE体系架构，熟悉java开源框架如Struts2、Spring、Hibernate、SPRINGMVC、MYBATIS等,1
696,能够制定需求管理计划，并严格监控，执行需求管理计划,4
697,负责制定设计规范，设计流程,1
698,精通Flash的编写以及ant编写环境下的scratch开发源代码读写能力(ant/Flex库),1
699,顺丰网络标准、制度、规范的制定和执行,4
700,日常主要负责华为核心交换机，防火墙、aruba无线网络设备、联想IBM服务器维护工作,0
701,有效地执行测试用例，提交缺陷以及测试报告,1
702,负责对销售人员的技能培训,0
703,负责toB工具类产品的交互设计，并对产品最终的用户体验负责,2
704,"""1、负责应用系统日常运维工作，包括系统的变更及发布审核、运行监控、事件响应及处理、用户服务请求，从业务操作、系统功能特性、接口逻辑等运用角度，对问题进行诊断及跟进解决",0
705,"完成上级交办的其它任务；""",3
706,"具有规范的代码编写习惯、良好的技术文档编写能力、流利的表达能力。""",1
707,能根据设计方案和计划进行编码实现，在进度和质量上符合方案和计划的要求,4
708,"""1.独立负责业务数据收集整理，搭建业务数据体系，结合业务对数据源进行深度诊断性组合、挖掘、分析",2
709,"负责核心产品（项目）业务系统的集成测试、系统测试、用户测试、性能测试，提交测试报告；2.负责核心产品（项目）业务系统的测试方案、测试用例的编写和评审，完成测试结果分析，并落实持续改进；3.掌握测试技术、测试工具和业务知识并进行指导、培训；4.能够及时反馈客户的问题,主动提升客户的满意度",2
710,"在某些项目中担当项目经理的角色管理项目范围、进度、风险等""",4
711,"负责组织技术研究和攻关工作，并负责组织和管理公司内部的技术培训工作。主要是完成数据平台之上各产品的开发""",4
712,负责数据仓库开发工作,0
713,参与全网数据中心的规划、设计和建设工作,0
714,新包装的工业化实现，及上市跟踪,4
715,"StrengthenCommunicationamongSFEU,OSRegionandHQincludingExpressBG/SFITcolleaguesondata/systemintegrationofEUrelatedprojects",4
716,深入研究电商WMS或OMS系统，发掘电商WMS或OMS产品应用需求。并与仓库运营及各业务条线紧密沟通，确定需求并制定相应的产品规划,2
717,对其他开发工程师进行技术培训指导,4
718,负责视觉相关功能算法的研究、实现和优化,1
719,"""1.负责顺丰科技运维团队的日常管理及运作",0
720,统筹设计及管理线上产品线、线下工具，实现线上产品与线下场景相互结合,2
721,能够独立负责完成App开发工作、熟悉iOS多线程、持久化存储、网络通信等开发；对用户体验、交互操作流程有深入理解,1
722,"对测试中发现的问题能够进行分析和定位，与开发人员、需求人员积极有效沟通，推动问题解决""",2
723,负责桌面相关系统或产品的流程、制度、操作手册制定与运维管理,0
724,对内、外部审计暴露出的重大风险和问题点，组织和推动各处室进行改进,4
725,负责公司网络的故障处理以及网络安全，网络质量及网络设备的监控,0
726,"负责自动化用例的编写和监控脚本维护；""",0
727,"""1.负责处理机器人感知方案的设计",0
728,协同其它部门完成输送分拣系统招评标工作，主导完成其中的技术标部分，及供应商细化方案审核,4
729,规划部门的自动化测试方向，负责自动化测试平台设计和开发工作，负责搭建自动化环境和框架,0
730,产品需求挖掘及收集：负责内外部产品调研分析，根据调研结果，形成产品规划意见提出明确产品需求。2.产品实施：负责原型设计、撰写需求文档，保证落实产品需求。跟进产品研发过程中反馈的问题，协调并提出相应产品改进方案。3.产品跟踪优化：收集反馈和新的产品需求，形成优化建议方案，推进产品优化的落实和相应产品指标的跟踪达成。4.产品持续运营：负责制定相关运营政策（如内容完善、活动策划、促销推广等），达成产品运营目标。5.协作支持：负责与关联部门职能协作，引导关联部门达成产品愿景,2
731,"""",4
732,针对新产品和新功能策划灰度用户测试计划，包括召集核心体验用户以及建立合适的测试过程,2
733,负责与业务部门交互沟通，协调研发部门、基础架构部门完成运维需求交付，并提供运维服务报告,0
734,"""1、负责办公场地机房、网络、服务器、办公电脑的日常运维",0
735,"""1、负责地区电商客户系统对接运维相关制度，标准，流程的落实与定期反馈",4
736,负责各类业务专项测试技术的研发和落地，有效提升测试的效率，高效保证版本质量,2
737,设计并开发相关的技术支撑平台,2
738,负责设计系统逻辑模型、数据模型和物理模型，并完成产品概要设计,1
739,"持续研究前沿技术并应用到产品中""",2
740,"""1.负责公司线上线下产品的视觉设计，包括线上APP，PC，小程序，线下的门店收银工具等",2
741,负责网络、机房、服务器相关技能的培训与支持工作,0
742,"""１、参与分布式对象存储、备份平台技术方案规划、设计、研发",1
743,负责设计测试用例，组织并进行产品测试，提交软件的测试报告,1
744,协调和推动业务、数据团队、将成熟的行业方案和应用案例沉淀到平台上，将产品和服务标准化输出,2
745,负责单板各功能模块驱动设计和开发调试,1
746,负责流程设计的推广支持工作,0
747,"完成上级交付的其他工作任务""",3
748,建立核心用户粉丝群，维护粉丝关系并协助产品利用该渠道进行用户调研和需求挖掘,2
749,负责Linux&unix操作系统自动化运维开发,0
750,"""1）快件分拣中心建设项目的工艺规划需求数据分析，工艺流程分析，工艺规划",2
751,"""1.	负责顺丰项目的H5前端设计和开发",0
752,安全检测策略和模型的开发设计,1
753,收集相关度量数据，进行针对性度量分析，定期出具质量监控报告,4
754,"参与系统平台开发进度计划制定，并配合后台开发人员实现前后台交互；""",1
755,负责供应商技术方案及详细设计的审核，,4
756,对公司内部剔除的IT需求进行初审，评估其需求品质及拖入与产出比，进行自助研发或上报,2
757,负责服务器的系统、应用运维工作，包括应用配置管理、系统监控、系统升级、系统安全、性能优化等工作,0
758,参与测试计划与用例、测试报告的编写，以及问题缺陷的发现及跟踪,1
759,"各产品易用性改进和界面技术优化""",2
760,"""1.Buildoptimizationmodelstocreatenew,scalablesolutionsforbusinessproblemssuchasscheduling,inventoryplanningandsupplychainmanagement(forecasting,planning,optimization,and/orlogistics)",1
761,"解决方案或实施文档（SOP,SOW等）编写",1
762,负责数字化业务Android/iOS平台功能特性开发和各类移动产品新技术预研,2
763,"""1、对接集团业务，进行需求调研，梳理控制需求",2
764,熟练掌握Struts、Spring、Hibernate等主流开发框架；后台，需要有实际使用经历,1
765,"对产品总的问题进行跟踪分析和报告，推动测试中发现问题及时合理地解决。""",4
766,维护业务数据模型，验证数据质量，保障数据完整和可靠,2
767,"""1.负责公司电脑端和移动端产品的UI设计",0
768,参与App架构设计，可独立承担模块设计并主导项目,1
769,"统筹协调所负责的项目，协调跨部门合作，推动业务、设计、开发、测试团队紧密合作，确保项目/产品按时按质完成；""",4
770,"""1.负责全栈产品（后台服务、接口、App、小程序、web等）的自动化测试开发和性能测试",1
771,能开发程序满足公司内部客户或客户个性化功能需求主，负责收集系统对接问题上报，分析需求可行性，协助需求部门完成需求的提交,2
772,"""1、按照工作计划，按时完成相关的设计、开发、单元测试任务",1
773,配合技术负责人进行系统总体方案设计,4
774,负责脚本编写及桌面小工具开发,1
775,"具有良好的团队意识和合作精神，擅于协调与沟通，能挖掘并引导客户需求""",2
776,带领项目组内初中级人员开展工作,4
777,优化质量管理标准和管理办法，并监控地区执行情况,4
778,与其它架构团队协作，对现有应用程序进行性能分析并提出相应的优化建议,1
779,"""1、本科及以上学历，计算机相关专业，三年以上JAVA开发经验",1
780,负责监控资金系统应用情况和软硬件的风险自查工作，满足外部监管及内部风控要求，确保安全合规,4
781,熟悉常用友盟，支付宝，微信，高德地图，极光推送等第三方,1
782,定期根据产品的核心数据进行分析，持续完善和优化已有产品功能,2
783,参与产品的设计，代码开发，应用自测和bug修复工作,1
784,"""1、协助销售完成客户开发工作，为客户提供专业解决方案，为销售提供专业技术支持与指导",2
785,负责运维主动预防工作，从应用系统架构、监控、容量、性能等方面进行分析以提前发现隐患问题，并推动优化解决，不断提高系统运行稳定性,0
786,推进线上重点问题的解决,4
787,"按时完成上级交办事宜。""",3
788,负责无人机的组装、调试和维护工作,0
789,"""1.	负责自动驾驶及车联网应用的产品研究、规划、定义、设计和完善",0
790,跟进市场调研分析，确定公司在市场运作上的主要策略并监督实施,4
791,组织进行业务需求研讨与分析工作，并形成业务需求基线,2
792,"负责使用常用数据分析及数据挖掘算法（时间序列/timeseries,分类/classification,聚类/clustering,文本挖掘/textmining,自然语言/NLP等）来改进或重新设计核心的运营步骤",1
793,"完成领导交办的其他各项工作；""",3
794,"负责对个性化系统的数据接口进行开发。""",0
795,"""1、与客户或业务部门沟通合作，推进数据在实际业务场景的应用，并提供数据解决方案",2
796,负责速运通APP项目安卓端开发2、负责定位并解决现有软件存在的问题3、按照项目计划按时提交高质量的代码完成开发任务4、规范和文档的编写、维护,4
797,"参与产品系统解决方案设计，确保产品方案与系统设计以及业务需求的相容性和一致性。""",2
798,"""1.对业务的成本模型和定价模型进行优化",2
799,建立健全客户关系管理系统，维护客户管理,0
800,负责Linux&unix操作系统开源工具引入及二次开发，包含类似Jumpserver、ansible、ELK、BT、pacemaker、oswatch等等,1
801,负责办公场地系统相关文档编写、用户培训和使用指导，受理用户事件和服务请求,0
802,"根据市场需求及公司定位制定本部门的市场营销策略以及规划，结合行业和社会热点进行市场推广，建立和保持良好的品牌形象和声誉。""",2
803,"进行数据分析和可用性测试，评估产品上线后的效果，并提出用户体验改善计划。""",2
804,负责制定软件测试计划，测试方案、用例的设计，测试环境的搭建和测试用例的执行,1
805,"掌握常用电气信号测量仪器的使用""",1
